text, textStyle
"Гостиная Анны Павловны начала понемногу наполняться. Приехала высшая знать Петербурга, люди самые разнородные по возрастам и характерам, но одинаковые по обществу, в каком все жили; приехала дочь князя Василия, красавица Элен, заехавшая за отцом, чтобы с ним вместе ехать на праздник посланника. Она была в шифре и бальном платье. Приехала и известная, как la femme la plus séduisante de Pétersbour, молодая, маленькая княгиня Болконская, прошлую зиму вышедшая замуж и теперь не выезжавшая в большой свет по причине своей беременности, но ездившая еще на небольшие вечера. Приехал князь Ипполит, сын князя Василия, с Мортемаром, которого он представил; приехал и аббат Морио и многие другие.
— Вы не видали еще, — или: — вы не знакомы с ma tante? — говорила Анна Павловна приезжавшим гостям и весьма серьезно подводила их к маленькой старушке в высоких бантах, выплывшей из другой комнаты, как скоро стали приезжать гости, называла их по имени, медленно переводя глаза с гостя на ma tante, и потом отходила.
Все гости совершали обряд приветствования никому не известной, никому не интересной и не нужной тетушки. Анна Павловна с грустным, торжественным участием следила за их приветствиями, молчаливо одобряя их. Ma tante каждому говорила в одних и тех же выражениях о его здоровье, о своем здоровье и о здоровье ее величества, которое нынче было, слава Богу, лучше. Все подходившие, из приличия не выказывая поспешности, с чувством облегчения исполненной тяжелой обязанности отходили от старушки, чтоб уж весь вечер ни разу не подойти к ней.
Молодая княгиня Болконская приехала с работой в шитом золотом бархатном мешке. Ее хорошенькая, с чуть черневшимися усиками верхняя губка была коротка по зубам, но тем милее она открывалась и тем еще милее вытягивалась иногда и опускалась на нижнюю. Как это бывает у вполне привлекательных женщин, недостаток ее — короткость губы и полуоткрытый рот — казались ее особенною, собственно ее красотой. Всем было весело смотреть на эту полную здоровья и живости хорошенькую будущую мать, так легко переносившую свое положение. Старикам и скучающим, мрачным молодым людям казалось, что они сами делаются похожи на нее, побыв и поговорив несколько времени с ней. Кто говорил с ней и видел при каждом слове ее светлую улыбочку и блестящие белые зубы, которые виднелись беспрестанно, тот думал, что он особенно нынче любезен. И это думал каждый.
Маленькая княгиня, переваливаясь, маленькими быстрыми шажками обошла стол с рабочею сумочкой на руке и, весело оправляя платье, села на диван, около серебряного самовара, как будто все, что она ни делала, было partie de plaisir для нее и для всех ее окружавших.
— J'ai apporté mon ouvrage, — сказала она, развертывая свой ридикюль и обращаясь ко всем вместе.
— Смотрите, Annette, ne me jouez pas un mauvais tour, — обратилась она к хозяйке. — Vous m'avez écrit que c'était une toute petite soirée; voyez comme je suis attifée.
И она развела руками, чтобы показать свое, в кружевах, серенькое изящное платье, немного ниже грудей опоясанное широкою лентой.
— Soyez tranquille, Lise, vous serez toujours la plus jolie, — отвечала Анна Павловна.
— Vous savez, mon mari m'abandonne, — продолжала она тем же тоном, обращаясь к генералу, — il va se faire tuer. Dites-moi, pourquoi cette vilaine guerre, — сказала она князю Василию и, не дожидаясь ответа, обратилась к дочери князя Василия, к красивой Элен.
— Quelle délicieuse personne, que cette petite princesse! — сказал князь Василий тихо Анне Павловне.
Вскоре после маленькой княгини вошел массивный, толстый молодой человек с стриженою головой, в очках, светлых панталонах по тогдашней моде, с высоким жабо и в коричневом фраке. Этот толстый молодой человек был незаконный сын знаменитого екатерининского вельможи, графа Безухова, умиравшего теперь в Москве. Он нигде не служил еще, только что приехал из-за границы, где он воспитывался, и был первый раз в обществе. Анна Павловна приветствовала его поклоном, относящимся к людям самой низшей иерархии в ее салоне. Но, несмотря на это низшее по своему сорту приветствие, при виде вошедшего Пьера в лице Анны Павловны изобразилось беспокойство и страх, подобный тому, который выражается при виде чего-нибудь слишком огромного и несвойственного месту. Хотя действительно Пьер был несколько больше других мужчин в комнате, но этот страх мог относиться только к тому умному и вместе робкому, наблюдательному и естественному взгляду, отличавшему его от всех в этой гостиной.",художественный
"Недавно я узнал, что Печорин, возвращаясь из Персии, умер. Это известие меня очень обрадовало: оно давало мне право печатать эти записки, и я воспользовался случаем поставить имя над чужим произведением. Дай Бог, чтоб читатели меня не наказали за такой невинный подлог!
Теперь я должен несколько объяснить причины, побудившие меня предать публике сердечные тайны человека, которого я никогда не знал. Добро бы я был еще его другом: коварная нескромность истинного друга понятна каждому; но я видел его только раз в моей жизни на большой дороге, следовательно, не могу питать к нему той неизъяснимой ненависти, которая, таясь под личиною дружбы, ожидает только смерти или несчастия любимого предмета, чтоб разразиться над его головою градом упреков, советов, насмешек и сожалений.
Перечитывая эти записки, я убедился в искренности того, кто так беспощадно выставлял наружу собственные слабости и пороки. История души человеческой, хотя бы самой мелкой души, едва ли не любопытнее и не полезнее истории целого народа, особенно когда она — следствие наблюдений ума зрелого над самим собою и когда она писана без тщеславного желания возбудить участие или удивление. Исповедь Руссо имеет уже недостаток, что он читал ее своим друзьям.
Итак, одно желание пользы заставило меня напечатать отрывки из журнала, доставшегося мне случайно. Хотя я переменил все собственные имена, но те, о которых в нем говорится, вероятно себя узнают, и, может быть, они найдут оправдания поступкам, в которых до сей поры обвиняли человека, уже не имеющего отныне ничего общего с здешним миром: мы почти всегда извиняем то, что понимаем.
Я поместил в этой книге только то, что относилось к пребывания Печорина на Кавказе; в моих руках осталась еще толстая тетрадь, где он рассказывает всю жизнь свою. Когда-нибудь и она явится на суд света; но теперь я не смею взять на себя эту ответственность по многим важным причинам.
Может быть, некоторые читатели захотят узнать мое мнение о характере Печорина? — Мой ответ — заглавие этой книги. Да это злая ирония! — скажут они. — Не знаю.
Тамань — самый скверный городишко из всех приморских городов России. Я там чуть-чуть не умер с голода, да еще в добавок меня хотели утопить. Я приехал на перекладной тележке поздно ночью. Ямщик остановил усталую тройку у ворот единственного каменного дома, что при въезде. Часовой, черноморский казак, услышав звон колокольчика, закричал спросонья диким голосом: Кто идет? Вышел урядник и десятник. Я им объяснил, что я офицер, еду в действующий отряд по казенной надобности, и стал требовать казенную квартиру. Десятник нас повел по городу. К которой избе ни подъедем — занята. Было холодно, я три ночи не спал, измучился и начинал сердиться. «Веди меня куда-нибудь, разбойник! хоть к черту, только к месту!» — закричал я. «Есть еще одна фатера, — отвечал десятник, почесывая затылок, — только вашему благородию не понравится; там нечисто!» Не поняв точного значения последнего слова, я велел ему идти вперед и после долгого странствования по грязным переулкам, где по сторонам я видел одни только ветхие заборы, мы подъехали к небольшой хате на самом берегу моря.
Полный месяц светил на камышовую крышу и белые стены моего нового жилища; на дворе, обведенном оградой из булыжника, стояла избочась другая лачужка, менее и древнее первой. Берег обрывом спускался к морю почти у самых стен ее, и внизу с беспрерывным ропотом плескались темно-синие волны. Луна тихо смотрела на беспокойную, но покорную ей стихию, и я мог различить при свете ее, далеко от берега, два корабля, которых черные снасти, подобно паутине, неподвижно рисовались на бледной черте небосклона. «Суда в пристани есть, — подумал я, — завтра отправлюсь в Геленджик».
При мне исправлял должность денщика линейский казак. Велев ему выложить чемодан и отпустить извозчика, я стал звать хозяина — молчат; стучу — молчат... что это? Наконец из сеней выполз мальчик лет четырнадцати.
Где хозяин? — Нема. — Как? совсем нету? — Совсим. — А хозяйка? — Побигла в слободку. — Кто же мне отопрет дверь? — сказал я, ударив в нее ногою. Дверь сама отворилась; из хаты повеяло сыростью. Я засветил серную спичку и поднес ее к носу мальчика: она озарила два белые глаза. Он был слепой, совершенно слепой от природы. Он стоял передо мною неподвижно, и я начал рассматривать черты его лица.
Признаюсь, я имею сильное предубеждение против всех слепых, кривых, глухих, немых, безногих, безруких, горбатых и проч. Я замечал, что всегда есть какое-то странное отношение между наружностью человека и его душою: как будто с потерею члена душа теряет какое-нибудь чувство.",художественный
"Летом можно смотаться в Сокольники, там есть особенная, очень хорошая трава, а кроме того, нажрёшься бесплатно колбасных головок, бумаги жирной набросают граждане, налижешься. И если бы не грымза какая-то, что поёт на лугу при луне – «Милая Аида» – так, что сердце падает, было бы отлично. А теперь куда пойдёшь? Не били вас сапогом? Били. Кирпичом по рёбрам получали? Кушано достаточно. Всё испытал, с судьбой своей мирюсь и, если плачу сейчас, то только от физической боли и холода, потому что дух мой ещё не угас… Живуч собачий дух.
Но вот тело моё изломанное, битое, надругались над ним люди достаточно. Ведь главное что – как врезал он кипяточком, под шерсть проело, и защиты, стало быть, для левого бока нет никакой. Я очень легко могу получить воспаление лёгких, а, получив его, я, граждане, подохну с голоду. С воспалением лёгких полагается лежать на парадном ходе под лестницей, а кто же вместо меня, лежащего холостого пса, будет бегать по сорным ящикам в поисках питания? Прохватит лёгкое, поползу я на животе, ослабею, и любой спец пришибёт меня палкой насмерть. И дворники с бляхами ухватят меня за ноги и выкинут на телегу…
Дворники из всех пролетариев – самая гнусная мразь. Человечьи очистки – самая низшая категория. Повар попадается разный. Например – покойный Влас с Пречистенки. Скольким он жизнь спас. Потому что самое главное во время болезни перехватить кус. И вот, бывало, говорят старые псы, махнёт Влас кость, а на ней с осьмушку мяса. Царство ему небесное за то, что был настоящая личность, барский повар графов Толстых, а не из Совета Нормального питания. Что они там вытворяют в Нормальном питании – уму собачьему непостижимо. Ведь они же, мерзавцы, из вонючей солонины щи варят, а те, бедняги, ничего и не знают. Бегут, жрут, лакают.
Иная машинисточка получает по IX разряду четыре с половиной червонца, ну, правда, любовник ей фильдеперсовые чулочки подарит. Да ведь сколько за этот фильдеперс ей издевательств надо вынести. Ведь он её не каким-нибудь обыкновенным способом, а подвергает французской любви. С… эти французы, между нами говоря. Хоть и лопают богато, и всё с красным вином. Да…
Прибежит машинисточка, ведь за 4,5 червонца в бар не пойдёшь. Ей и на кинематограф не хватает, а кинематограф у женщины единственное утешение в жизни. Дрожит, морщится, а лопает… Подумать только: 40 копеек из двух блюд, а они оба эти блюда и пятиалтынного не стоят, потому что остальные 25 копеек завхоз уворовал. А ей разве такой стол нужен? У неё и верхушка правого лёгкого не в порядке и женская болезнь на французской почве, на службе с неё вычли, тухлятиной в столовой накормили, вот она, вот она…
Бежит в подворотню в любовниковых чулках. Ноги холодные, в живот дует, потому что шерсть на ней вроде моей, а штаны она носит холодные, одна кружевная видимость. Рвань для любовника. Надень-ка она фланелевые, попробуй, он и заорёт: до чего ты неизящна! Надоела мне моя Матрёна, намучился я с фланелевыми штанами, теперь пришло моё времечко. Я теперь председатель, и сколько ни накраду – всё на женское тело, на раковые шейки, на абрау-дюрсо. Потому что наголодался я в молодости достаточно, будет с меня, а загробной жизни не существует.
Учиться читать совершенно ни к чему, когда мясо и так пахнет за версту. Тем не менее (ежели вы проживаете в Москве, и хоть какие-нибудь мозги у вас в голове имеются), вы волей-неволей научитесь грамоте, притом безо всяких курсов. Из сорока тысяч московских псов разве уж какой-нибудь совершенный идиот не сумеет сложить из букв слово колбаса.",художественный
