text, textStyle
"В пять часов утра, как всегда, пробило подъём — молотком об рельс у штабного барака. Перерывистый звон слабо прошёл сквозь стёкла, намёрзшие в два пальца, и скоро затих: холодно было, и надзирателю неохота была долго рукой махать.
Звон утих, а за окном всё так же, как и среди ночи, когда Шухов вставал к параше, была тьма и тьма, да попадало в окно три жёлтых фонаря: два — на зоне, один — внутри лагеря.
И барака что-то не шли отпирать, и не слыхать было, чтобы дневальные брали бочку парашную на палки — выносить.
Шухов никогда не просыпал подъёма, всегда вставал по нему — до развода было часа полтора времени своего, не казённого, и кто знает лагерную жизнь, всегда может подработать: шить кому-нибудь из старой подкладки чехол на рукавички; богатому бригаднику подать сухие валенки прямо на койку, чтоб ему босиком не топтаться вкруг кучи, не выбирать; или пробежать по каптёркам, где кому надо услужить, подмести или поднести что-нибудь; или идти в столовую собирать миски со столов и сносить их горками в посудомойку — тоже накормят, но там охотников много, отбою нет, а главное — если в миске что осталось, не удержишься, начнёшь миски лизать. А Шухову крепко запомнились слова его первого бригадира Кузёмина — старый был лагерный волк, сидел к девятьсот сорок третьему году уже двенадцать лет, и своему пополнению, привезенному с фронта, как-то на голой просеке у костра сказал:
— Здесь, ребята, закон — тайга. Но люди и здесь живут. В лагере вот кто подыхает: кто миски лижет, кто на санчасть надеется да кто к куму ходит стучать.
Насчёт кума — это, конечно, он загнул. Те-то себя сберегают. Только береженье их — на чужой крови.
Всегда Шухов по подъёму вставал, а сегодня не встал. Ещё с вечера ему было не по себе, не то знобило, не то ломало. И ночью не угрелся. Сквозь сон чудилось — то вроде совсем заболел, то отходил маленько. Всё не хотелось, чтобы утро.
Но утро пришло своим чередом. Да и где тут угреешься — на окне наледи намётано, и на стенах вдоль стыка с потолком по всему бараку — здоровый барак! — паутинка белая. Иней.
Шухов не вставал. Он лежал на верху вагонки, с головой накрывшись одеялом и бушлатом, а в телогрейку, в один подвёрнутый рукав, сунув обе ступни вместе. Он не видел, но по звукам всё понимал, что делалось в бараке и в их бригадном углу. Вот, тяжело ступая по коридору, дневальные понесли одну из восьмиведерных параш. Считается инвалид, лёгкая работа, а ну-ка поди вынеси, не пролья! Вот в 75-й бригаде хлопнули об пол связку валенок из сушилки. А вот — и в нашей (и наша была сегодня очередь валенки сушить). Бригадир и помбригадир обуваются молча, а вагонка их скрипит. Помбригадир сейчас в хлеборезку пойдёт, а бригадир — в штабной барак, к нарядчикам.
Да не просто к нарядчикам, как каждый день ходит, — Шухов вспомнил: сегодня судьба решается — хотят их 104-ю бригаду фугануть со строительства мастерских на новый объект «Соцгородок». А Соцгородок тот — поле голое, в увалах снежных, и, прежде чем что там делать, надо ямы копать, столбы ставить и колючую проволоку от себя самих натягивать — чтоб не убежать. А потом строить.
Там, верное дело, месяц погреться негде будет — ни конурки. И костра не разведёшь — чем топить? Вкалывай на совесть — одно спасение.",художественный
"Все счастливые семьи похожи друг на друга, каждая несчастливая семья несчастлива по-своему.
Все смешалось в доме Облонских. Жена узнала, что муж был в связи с бывшею в их доме француженкою-гувернанткой, и объявила мужу, что не может жить с ним в одном доме. Положение это продолжалось уже третий день и мучительно чувствовалось и самими супругами, и всеми членами семьи, и домочадцами. Все члены семьи и домочадцы чувствовали, что нет смысла в их сожительстве и что на каждом постоялом дворе случайно сошедшиеся люди более связаны между собой, чем они, члены семьи и домочадцы Облонских. Жена не выходила из своих комнат, мужа третий день не было дома. Дети бегали по всему дому, как потерянные; англичанка поссорилась с экономкой и написала записку приятельнице, прося приискать ей новое место; повар ушел вчера со двора, во время самого обеда; черная кухарка и кучер просили расчета.
На третий день после ссоры князь Степан Аркадьич Облонский — Стива, как его звали в свете, — в обычный час, то есть в восемь часов утра, проснулся не в спальне жены, а в своем кабинете, на сафьянном диване. Он повернул свое полное, выхоленное тело на пружинах дивана, как бы желая опять заснуть надолго, с другой стороны крепко обнял подушку и прижался к ней щекой; но вдруг вскочил, сел на диван и открыл глаза.
Да, да, как это было? — думал он, вспоминая сон. — Да, как это было? Да! Алабин давал обед в Дармштадте; нет, не в Дармштадте, а что-то американское. Да, но там Дармштадт был в Америке. Да, Алабин давал обед на стеклянных столах, да, — и столы пели: Il mio tesoro и не Il mio tesoro, а что-то лучше, и какие-то маленькие графинчики, и они же женщины, — вспоминал он.
Глаза Степана Аркадьича весело заблестели, и он задумался, улыбаясь. Да, хорошо было, очень хорошо. Много еще что-то там было отличного, да не скажешь словами и мыслями даже наяву не выразишь». И, заметив полосу света, пробившуюся сбоку одной из суконных стор, он весело скинул ноги с дивана, отыскал ими шитые женой (подарок ко дню рождения в прошлом году), обделанные в золотистый сафьян туфли, и по старой, девятилетней привычке, не вставая, потянулся рукой к тому месту, где в спальне у него висел халат. И тут он вспомнил вдруг, как и почему он спит не в спальне жены, а в кабинете; улыбка исчезла с его лица, он сморщил лоб.
Ах, ах, ах! Ааа!.. — замычал он, вспоминая все, что было. И его воображению представились опять все подробности ссоры с женою, вся безвыходность его положения и мучительнее всего собственная вина его.
Да! она не простит и не может простить. И всего ужаснее то, что виной всему я, виной я, а не виноват. В этом-то вся драма, — думал он. — Ах, ах, ах! — приговаривал он с отчаянием, вспоминая самые тяжелые для себя впечатления из этой ссоры.
Неприятнее всего была та первая минута, когда он, вернувшись из театра, веселый и довольный, с огромною грушей для жены в руке, не нашел жены в гостиной; к удивлению, не нашел ее и в кабинете и, наконец, увидал ее в спальне с несчастною, открывшею все, запиской в руке.
Она, эта вечно озабоченная, и хлопотливая, и недалекая, какою он считал ее, Долли, неподвижно сидела с запиской в руке и с выражением ужаса, отчаяния и гнева смотрела на него.
— Что это? это? — спрашивала она, указывая на записку.
И при этом воспоминании, как это часто бывает, мучало Степана Аркадьича не столько самое событие, сколько то, как он ответил на эти слова жены.
С ним случилось в эту минуту то, что случается с людьми, когда они неожиданно уличены в чем-нибудь слишком постыдном. Он не сумел приготовить свое лицо к тому положению, в которое он становился перед женой после открытия его вины. Вместо того чтоб оскорбиться, отрекаться, оправдываться, просить прощения, оставаться даже равнодушным — все было бы лучше того, что он сделал! — его лицо совершенно невольно («рефлексы головного мозга», — подумал Степан Аркадьич, который любил физиологию), совершенно невольно вдруг улыбнулось привычною, доброю и потому глупою улыбкой.",художественный
"7 февраля в шесть часов утра Гленарван дал сигнал к отправлению. Дождь прекратился ночью. Сероватые тучки, заволакивавшие небо, не пропускали солнечных лучей на высоте трех миль от земли. Умеренная жара обещала, что предстоящее путешествие не будет слишком утомительным.
Паганель определил по карте расстояние от мыса Кахвиа до Окленда: оно равнялось восьмидесяти милям, которые можно было пройти в восемь дней, делая по десяти миль в день. Но вместо того чтобы идти вдоль извилистых берегов моря, географ предпочел направиться к селению Нгаруавахиа, расположенному в тридцати милях, при слиянии двух рек — Уаикато и Вайпа. Там пролегал «почтовый тракт», точнее — тропа, доступная для повозок, пересекавшая почти весь остров — от Нейпира у залива Хокса и дальше до Окленда. По тракту можно было добраться до Дрюри, там следует отдохнуть в хорошей гостинице, которую особенно рекомендует естествоиспытатель Гохштеттер. Распределив между собой съестные припасы, путешественники двинулись вдоль берега бухты Аотеа. Из предосторожности они шли, держа наготове заряженные карабины, пристально вглядываясь в холмистые равнины, расстилавшиеся к востоку.
Паганель поминутно заглядывал в карту и как знаток восторгался точностью ее малейших деталей.
Часть дня маленький отряд шел по песку, образовавшемуся из осколков двустворчатых раковин, высохших костей, смешанных главным образом с перекисью и закисью железа. Стоит приблизить к такой почве магнит, как он тотчас же покрывается блестящими кристалликами.
На берегу, о который бесшумно плескались волны прилива, безбоязненно резвилось несколько тюленей. Эти морские животные, с круглой головой, широким покатым лбом, выразительными глазами, имели добродушный вид. Глядя на них, понятно, почему мифология, воспевая этих своеобразных обитателей моря, воплотила в них образ обольстительницы-сирены.
Тюлени во множестве водятся у берегов Новой Зеландии, охота на них представляет собой выгодное занятие, так как их жир и кожа пользуются большим спросом.
Среди тюленей выделялись три-четыре морских слока. Они были серо-голубого цвета, длиной в двадцать пять — тридцать футов. Эти огромные животные лениво раскинулись на толстом слое гигантских водорослей — ламинарий, поднимали хобот, смешно поводили длинными, грубыми усами, завитыми колечками, как бороды щеголей.
Роберт с интересом наблюдал за ними.
— Каково! — вдруг воскликнул удивленный мальчуган. — Тюлени едят гальку!
Действительно, некоторые животные с жадностью глотали валявшиеся на берегу камешки.
— Тюлени глотают береговую гальку, — ответил Паганель. — Это несомненно.
— Какая странная пища, ведь ее трудно переварить, — удивился Роберт.
— Эти животные глотают камни не для того, чтобы насытиться ими, а для того, чтобы нагрузить себя балластом и таким образом легче опуститься на дно. Вернувшись на берег, они без дальних церемоний выбросят из себя этот балласт. Ты сейчас увидишь, как тюлени, наглотавшись камешков, нырнут в воду.
Действительно, вскоре с полдюжины тюленей, видимо достаточно нагрузив себя балластом, тяжело переваливаясь, поползли по берегу и исчезли в водной стихии. Но Гленарван не мог терять драгоценное время, ожидая возвращения тюленей на берег, и затем наблюдать, как они начнут разгружаться. К большому огорчению Паганеля, маленький отряд опять тронулся в путь.
В десять часов остановились для завтрака на привал у подножия большой базальтовой скалы, на берегу моря. Скалы эти были словно кельтские каменные памятники. Здесь на мели нашли множество устриц, но они были мелкие и малоприятные на вкус. По совету Паганеля, Олбинет испек их на раскаленных угольях, и в таком виде они имели большой успех — за завтраком их съели не одну дюжину.
Отдохнув, путешественники снова двинулись вдоль берега бухты. На гребнях скал ютилось множество морских птиц: фрегаты, глупыши, чайки и, наконец, огромные альбатросы, неподвижно сидевшие на остроконечных верхушках утесов.
К четырем часам пополудни пройдено было без всякого напряжения и усталости десять миль. Путешественники решили идти вперед до самой ночи, когда надо было изменить направление пути и продвигаться вдоль подножия гор, видневшихся на севере, а обогнув их, углубиться в долину реки Вайпа.
Вдали простирались бесконечные луга, казалось, что по ним легко будет идти. Но, приблизившись к этому морю зелени, путешественники были разочарованы: вместо травы перед ними была поросль кустарников с белыми цветами, среди которой виднелось бесчисленное множество высоких папоротников, очень распространенных в Новой Зеландии. Пришлось прокладывать дорогу между деревянистыми стеблями, что было трудно. Тем не менее к восьми часам вечера миновали первые отроги горной цепи Хакарихатоа — Ран и остановились на привал.
После перехода в четырнадцать миль следовало подумать об отдыхе. Так как не было ни фургона, ни палатки, то легли под сенью великолепных норфолкских сосен. К счастью, в одеялах недостатка не было, и, разостлав их, устроили постели.",художественный
"Жечь было наслаждением. Какое-то особое наслаждение видеть, как огонь пожирает вещи, как они чернеют и меняются. Медный наконечник брандспойта зажат в кулаках, громадный питон изрыгает
на мир ядовитую струю керосина, кровь стучит в висках, а руки кажутся руками диковинного дирижера, исполняющего симфонию
огня и разрушения, превращая в пепел изорванные, обуглившиеся страницы истории. Символический шлем, украшенный цифрой 451, низко надвинут на лоб; глаза сверкают оранжевым пламенем при
мысли о том, что должно сейчас произойти:он нажимает воспламенитель — и огонь жадно бросается на дом, окрашивая вечернее небо в багрово-желто-черные тона. Он шагает в рое огненно-
красных светляков, и больше всего ему хочется сделать сейчас то, чем он так часто забавлялся в детстве, — сунуть в огонь прутик с
леденцом, пока книги, как голуби, шелестя крыльями-страницами, умирают на крыльце и на лужайке перед домом; они взлетают в огненном вихре, и черный от копоти ветер уносит их прочь.
Жесткая улыбка застыла на лице Монтэга, улыбка-гримаса, которая появляется на губах у человека, когда его вдруг опалит огнем и он стремительно отпрянет назад от его жаркого прикосновения. Он знал, что, вернувшись в пожарное депо, он, менестрель огня,
взглянув в зеркало, дружески подмигнет своему обожженному, измазанному сажей лицу. И позже в темноте, уже засыпая, он все еще
будет чувствовать на губах застывшую судорожную улыбку. Она никогда не покидала его лица, никогда, сколько он себя помнит.
Он тщательно вытер и повесил на гвоздь черный блестящий шлем, аккуратно повесил рядом брезентовую куртку, с наслаждением вымылся под сильной струей душа и, насвистывая, сунув руки в
карманы, пересек площадку верхнего этажа пожарной станции и скользнул в люк. В последнюю секунду, когда катастрофа уже казалась неизбежной, он выдернул руки из карманов, обхватил блестящий.",художественный
