text, textStyle
имидж и образ с точки зрения языковой интерпретации, а Д.С. Кадачигова выявляла особенности трактовок с помощью системного подхода. В лингвистике термин изучается в рамках нового направления лингвистических исследований – лингвоимиджелогии.
В зарубежных книгах и статьях «имидж» рассматривается с точки зрения маркетинга и рекламы. В книге Имидж-реклама Ф. Котлера и А. Сенгупта профессиональный облик определяется как образ, создаваемый компанией для своего продукта или услуги с целью привлечения внимания потребителей и выделения среди конкурентов.
В статье "Имидж и бренд: взаимосвязь и влияние на успех" Д.А. Аакер и Э. Йохимштайлер утверждают, что имидж – это восприятие компании или продукта потребителями, основанное на их опыте, знаниях и эмоциях, и он может помочь достичь конкурентных преимуществ и увеличить долю рынка. С. Брэнд рассматривает понятие имидж как «внешнее
отражение внутреннего мира человека», полагая, что он формируется на основе самоощущения, ценностей, убеждений и поведения человека. Роль лидерства в формировании профессионального образа подчёркивает Р.Л. Хоффман, утверждая, что самопрезентация лидера становится образцом для подражания, и стоит формировать положительный имидж своей
организации или движения. В зарубежной литературе понятие "имидж" также рассматривается в контексте связей с общественностью (PR). В книге "Имидж и PR" Дж. Г. Меллера и Дж. Р. Мозера говорится, что имидж – это образ, который организация или личность стремится создать и поддерживать в глазах общественности, и использование этого понятия способствует укреплению репутации, привлечению инвестиций и расширению аудитории. Для определения факторов, влияющих на успешность имиджа конкретных личностей и роль телеведущих, включая тех, кто освещает новости, необходимо изучить исторический контекст в зарубежных и отечественных реалиях. Процесс формирования имиджа начался у американских телеведущих в 1960-х годах с появлением ток-шоу «Phil Donahue Show», где ведущий общался со зрителями и обсуждал различные вопросы. Это также положило начало жанра ток-шоу. Развитие профессионального имиджа телеведущего в США можно разделить на несколько этапов. В начало XX века телевидение становится главным источником информации
и развлечения. Ведущих ценят за человеческие и профессиональные качества, способность вызывать доверие и уважение у зрителей.
1930–1950-е годы: развитие многоканального телевидения, использование разных методов общения и жанров телепрограмм. Важное значение имеют внешние данные: здоровый вид,
красивая внешность, приятный голос и жесты. Появляются первые популярные телеведущие, такие как Милтон Берл, Эд Салливан и Артур Годфри.
1950–1960-е годы: профессия телеведущего развивается в США, формируются стандарты и функции.
1960–1970-е годы: появление развлекательных шоу, где телеведущие должны обладать чувством юмора и умением общаться с аудиторией.
1980–1990-е годы: развитие ток-шоу и юмористических программ, где представители СМИ должны быть эмоциональными и уметь тонко подшучивать. Этот этап также был изучен И.А. Русаковой, экспертом по коммуникации и PR. Она рассмотрела историю становления и формирования имиджа телеведущего в США с 1950-х годов.
Автор также отмечает, что в этот период телевидение становится главным источником информации и развлечений для населения, и телеведущие играют важную роль в формировании общественного мнения. Телеведущие становятся символами культуры, их образы и стиль
жизни становятся примером для подражания для миллионов зрителей. Развитие имиджа в российской тележурналистике обусловлено переменами в организации и практике телевещания, связанными с формированием новой информационной парадигмой. Этот процесс можно проследить в историческом контексте.
В советское время имидж тележурналистов определялся идеологическими нормами поведения, которые служили ориентиром для общества. Телевидение использовалось как инструмент пропаганды, и в эфир выходили только «одобряемые» передачи и новости.
В 1920-е годы, когда началось регулярное Всесоюзное радиовещание, дикторы стали олицетворением власти и почти небожителями.
В 1950–1960-е годы имидж телеведущих напрямую зависел от их статуса и репутации. Ведущие должны были обладать харизмой, уверенностью и профессионализмом. Они часто появлялись на экране в строгих костюмах и галстуках, что создавало образ серьёзного и ответственного человека. Светлана Жильцова, одна из самых известных телеведущих того времени, носила короткие стрижки и яркие наряды, что делало её образ запоминающимся и привлекательным.
В 1970–1980-е годы имидж телеведущих стал более разнообразным и индивидуальным. В конце советского периода имидж телеведущих претерпел значительные изменения. Ведущие стали более открытыми и доступными для аудитории. Они начали общаться со зрителями, делиться своими мыслями и чувствами. Это сделало их ближе к зрителям и помогло
создать доверительные отношения между ними. На основе рассмотренной выше информации становится возможно сформулировать основный компоненты, которые влияют на возникновение и развитие имиджа телеведущего.
Среди них: харизма, эмоциональная устойчивость, чувство времени, ответственность и организованность, развитый речевой аппарат, умение импровизировать, коммуникабельность, эмпатия и адаптивность.
В заключение хочется отметить, что историческая роль имиджа телеведущих в работах отечественных и зарубежных учёных имеет большое значение для понимания процессов формирования и развития изучаемого понятия в средствах массовой коммуникации. Изучение
трудов позволяет проследить эволюцию представлений, выделить основные тенденции и закономерности его становления и изменения",научный
"Для общественных пространств курортных городов Крыма характерна линейная схема развития с расчлененными взаимосвязанными пространствами, что обусловлено природными факторами и исторически сложившимися этапами застройки территории. Структура общественных пространств тяготеет к морскому побережью. Как правило общественные пространства начинают свое развитие от набережных и включают в свою систему примыкающие к набережной бульвары, площади, скверы, набережные рек. Этапное развитие территории
приводит к тому, что набережные обрастая воднотранспортной инфраструктурной фиксируют историческое положение городского каркаса город развиваясь, прирастает новыми территориями и набережные разделяются элементами инфраструктуры водного транспорта– у которых набережная разделена на две части морским портом как в Ялте и Алуште, или неосуществленным яхт-клубом как в Алуште. В результате разорванности связей транспортнопешеходных нарушается композиция городского каркаса, и две части одной по факту набережной живут своей жизнью.
Характерным для крымских курортных городов является притяжение общественных пространств к набережной и как правило линейной структуры с формированием центра композиции от площади или бульвара расположенного перпендикулярно берегу, развитием пространства различного функционального назначения.
Город Алушта, Республика Крым. Протяженность набережной 3.56 км. Условно общественное пространство набережной можно разделить на три части, Набережная улица (Профессорский уголок). Центральная часть – городской пляж и Восточная Набережная от реки
Демерджи до комплекса Лазурный. Все три части набережной связаны только береговой полосой.
1. Композиционная целостность структуры нарушена, отсутствует общая композиция
застройки и благоустройства. Нет композиционной доминанты, застройка и элементы благоустройства выглядят стихийными, хаотичными. Отсутствует определенное стилистическое решение застройки.
2. На Набережной улице и Восточной набережной части отсутствует транспортно-пешеходной разграничение. Недостаточное количество автостоянок, отсутствие перехватывающих
стоянок. Доступ к сетям общественного транспорта в районе улицы Набережной и Восточной
Набережной отсутствует. Пешеходные сети не развиты.
3. Инженерные сети изношены. Дорожные покрытия Восточной Набережной изношены,
не отвечают стандартам. Отсутствие системы очистки поверхностных вод с дорожных покрытий. Набережная реки Демерджи изношена, размыты берега, повреждены ограждения. Система ориентации по территории отсутствует. Нет системы безопасности.
4. Зона озеленения уменьшается, отсутствует разнообразие проектных решений элементов благоустройства. Недостаток элементов благоустройства и малых архитектурных форм в
единой стилистике. Недостаточно развита сеть общественных уборных. Отсутствует система
ориентирования в городе.
В целом общественная среда Алушты имеет большой потенциал для развития, ограниченный сложностью освоения территории и требующих сложных инженерных решений. Алушта нуждается в разработке территориального брендинга, необходима продуманная пошаговая стратегия, предназначенная для поиска решений, повышающих привлекательность и
узнаваемость общественных территорий и города в целом, что позволит привлечь инвестиции в развитие города. Городские общественные пространства значительно озеленены. Недостаточно развита сеть общественных уборных. Отсутствует система ориентирования в городе.",научный
"Война изуродовала Боровое. Вперемежку с уцелевшими избами стояли, как памятники народного горя, обуглившиеся печи. Торчали столбы от ворот. Сарай зиял огромной дырой – от него отломили половину и унесли.
Были сады, а теперь пни – как гнилые зубы. Лишь кое-где приютились по две-три яблоньки-подростка.
Село обезлюдело. Когда однорукий Федор вернулся домой, мать была в живых. Состарилась, отощала, седины прибавилось. Усадила за стол, а угощать-то и нечем. Было у Федора свое, солдатское. За столом мать рассказала: всех пообирали, шкуродеры окаянные! Прятали мы свиночек да курочек, кто куда горазд. Да неужто убережешь? Он шумит-грозит, подавай ему курицу, будь хоть распоследняя. С перепугу и последнюю отдавали. Вот и у меня ничего не осталось. Ой, худо было! Разорил село фашист проклятый! Сам видишь, что осталось… больше половины дворов спалил. Народ кто куда разбежался: кто в тыл, кто в партизаны. Девчонок сколько поугоняли! Вот и нашу Фросю увели…
За день-два огляделся Федор. Стали возвращаться свои, боровские. Повесили на пустой избе фанерку, а по ней кривобокими буквами сажей на масле – не было краски – «Правление колхоза «Красная заря» – и пошло, и пошло! Лиха беда – начало.",художественный
" В белом плаще с кровавым подбоем, шаркающей кавалерийской походкой, ранним утром четырнадцатого числа весеннего месяца нисана в крытую колоннаду между двумя крыльями дворца ирода великого вышел прокуратор Иудеи Понтий Пилат.
Более всего на свете прокуратор ненавидел запах розового масла, и все теперь предвещало нехороший день, так как запах этот начал преследовать прокуратора с рассвета. Прокуратору казалось, что розовый запах источают кипарисы и пальмы в саду, что к запаху кожи и конвоя примешивается проклятая розовая струя. От флигелей в тылу дворца, где расположилась пришедшая с прокуратором в Ершалаим первая когорта двенадцатого молниеносного легиона, заносило дымком в колоннаду через верхнюю площадку сада, и к горьковатому дыму, свидетельствовавшему о том, что кашевары в кентуриях начали готовить обед, примешивался все тот же жирный розовый дух. О боги, боги, за что вы наказываете меня?
"Да, нет сомнений! Это она, опять она, непобедимая, ужасная болезнь гемикрания, при которой болит полголовы. От нее нет средств, нет никакого спасения. Попробую не двигать головой".
На мозаичном полу у фонтана уже было приготовлено кресло, и прокуратор, не глядя ни на кого, сел в него и протянул руку в сторону.Секретарь почтительно вложил в эту руку кусок пергамента. Не удержавшись от болезненной гримасы, прокуратор искоса, бегло проглядел написанное, вернул пергамент секретарю и с трудом проговорил:
– Подследственный из Галилеи? К тетрарху дело посылали?
– Да, прокуратор, – ответил секретарь.
– Что же он?
– Он отказался дать заключение по делу и смертный приговор Синедриона направил на ваше утверждение, – объяснил секретарь.
Прокуратор дернул щекой и сказал тихо:
– Приведите обвиняемого.
И сейчас же с площадки сада под колонны на балкон двое легионеров ввели и поставили перед креслом прокуратора человека лет двадцати семи. Этот человек был одет в старенький и разорванный голубой хитон. Голова его была прикрыта белой повязкой с ремешком вокруг лба, а руки связаны за спиной. Под левым глазом у человека был большой синяк, в углу рта – ссадина с запекшейся кровью. Приведенный с тревожным любопытством глядел на прокуратора.
Тот помолчал, потом тихо спросил по-арамейски:
– Так это ты подговаривал народ разрушить Ершалаимский храм?
Прокуратор при этом сидел как каменный, и только губы его шевелились чуть-чуть при произнесении слов. Прокуратор был как каменный, потому что боялся качнуть пылающей адской болью головой.
Человек со связанными руками несколько подался вперед и начал говорить:
– Добрый человек! Поверь мне...
Но прокуратор, по-прежнему не шевелясь и ничуть не повышая голоса, тут же перебил его:
– Это меня ты называешь добрым человеком? Ты ошибаешься. В Ершалаиме все шепчут про меня, что я свирепое чудовище, и это совершенно верно, – и так же монотонно прибавил: – Кентуриона Крысобоя ко мне.",художественный
