text, textStyle
"Человек является значимой фигурой для нашей планеты, так как именно с его появления
появились первые зачатки культуры. Животные имеют более глубокую связь с естественностью и природой, однако кроме инстинктов и самых примитивных эмоций (причём эмоций не человеческих) у них больше ничего нет. Культура начинается с появления языка, в то время
как животные используют его для связи с себе подобными, а за идентификацию себя и других созданий в этом мире отвечает природная иерархия, отношение хищника и добычи, а также
деление на самок и самцов. Примитивный набор информации, передаваемый от матери к детенышу, никогда не выходил за эти рамки вплоть до появления нового живого существа –
человека. Даже для животного мира человек остается большим вопросом, так как его нельзя идентифицировать как полноправного хищника, который стремиться завоевать их территорию. Как только появился язык, культура, которая, как мы привыкли считать, объединяет
людей, сами люди наоборот разделили зарождающееся человечество на разные племена, а уже затем на разные народы. С появлением новых народов приходили и новые культуры, многие
их которых не дожили до нашего времени. Империи разрушались, а небольшие племена превращались в сильные и богатые государства, хранившие свою историю и культуру, выражавшуюся как в виде монет и сокровищ, так и в архитектурном облике городов.
Многовековое развитие города стало возможным, в частности, благодаря достижению горожанами новой ступени его культурного статуса. Породивший большой спектр профессий,
относящихся к культуре, город предоставил горожанам многие элементы досуга и отдыха. Один из многих таких элементов являются парки. Организация культурной жизнедеятельности в садах как часть благоприятной рекреационной среды в шумных городах пробудила интерес среди городского населения. Это поспособствовало появлению художественных центров при парковых учреждениях. Они стали новым культурным явлением, объединившим людей большого искусства: художников,
музыкантов, театралов и др. Уже тогда парки переставали быть отдельными островами тишины для господ, так как они стали более доступными. Уже тогда зарождалась идея парков
как группового пространства, являющихся точками притяжения, общения и генерации новых идей и мыслей.", научный
"Проблема роста числа домашних питомцев с новообразованиями молочных желез, а также не утешительные результаты при лечении собак и кошек с раком молочной железы последних стадий, определяют актуальность систематизации анализа и общности данной патологии, сравнение различных систем и способов лечения и разработки наиболее эффективных
и перспективных схем для лечения и улучшения качества жизни пациентов. В настоящее время активно применяется противоопухолевая химиотерапия, как у операбельных, так и у неоперабельных больных. Лечебный режим химиотерапии подбирается для продления жизни пациенту при неоперабельном случае и при активном метастатическом процессе, в постоперационный период химиотерапию используют для контроля роста опухоли. Все чаще используются схемы паллиативной терапии у отдельных групп онкологических больных, в связи с появлением новейших препаратов. Поскольку в современной зарубежной практике широко используются Ингибиторы циклооксигеназы-2 для лечения и при профилактике различных новообразований, то и для отечественной практики необходимо
изучение и сравнение данного метода. Для ветеринарных врачей очень важна ранняя и точная диагностика опухолевых заболеваний молочных желез, что позволит разработать оптимальную тактику и подобрать необходимую методику лечения, включая цитостатические препараты. Нужно учитывать, что патологический рост и развитие клеток, характерные для опухолей, существенно отличаются от
нормального по строению, свойствам и обмену веществ. Опухолевая ткань с нарушенной регуляцией характеризуется прогрессирующим размножением и накоплением не полностью дифференцированных клеток. Опухоли не только не имеют функционального значения для самого организма, а наоборот, причиняют вред его здоровью в связи со сдавливанием и разрушением окружающих опухоль клеток и тканей, нарушением питания и обмена веществ и интоксикацией организма.
Среди злокачественных новообразований, выявленных у кошек, наиболее часто обнаруживали аденокарциному молочной железы – 90 % случаев. Средний возраст заболевших кошек – 10 лет. Аденокарцинома у кошки – это одно из самых часто встречающихся злокачественных онкологических заболеваний. Характеризуется поражением клеток эпителия, чаще всего затрагивает молочные железы. В отличие от доброкачественной опухоли (аденомы), карцинома склонна к быстрому росту, а ее клетки имеют различную форму и размер, при этом сама ткань повторяет форму и размер самой железы, которую и копирует. При выявлении опухоли молочной железы и установлении диагноза «аденокарцинома» прогноз заболевания неблагоприятный: 70–80 % кошек погибает в течение года от рецидивов. Аденокарцинома растёт относительно медленно, длительно не даёт метастазов, из-за чего её сложно диагностировать на ранних стадиях. Для постановки точного диагноза необходимо гистологическое исследование биопсийного или постоперационного материала. При подозрении
на аденокарциному молочной железы у кошек необходимо обратиться к ветеринару. Умеренно дифференцированная аденокарцинома чаще всего развивается у животных с отягощающей наследственностью: если предки страдали от рака, вероятность его развития у потомства возрастает в разы. При этом особую роль играет качество питания, экология, травмы и другие провоцирующие факторы.", научный
"Ключевую роль в развитии городов, определении их стратегии, основных направлений градостроительство играет генеральный план. Он представляет собой документ территориального планирования муниципальных образований, содержащий комплексное решение задач развития территории с учётом социальных, экономических, экологических и других факторов. Генеральный план включает в себя разработку функциональных зон, определение мест для строительства жилых комплексов, общественно-деловых объектов, парков, промышленных предприятий и других инфраструктурных объектов, что позволяет рационально использовать территорию, обеспечить эффективное развитие городских пространств и создать комфортную среду для жизни населения. Генплан имеет большое значение для развития территорий, поскольку он создаёт основу
для комплексного решения вопросов организации планировочной структуры, территориального, инфраструктурного и социально-экономического развития поселений. Он определяет правила землепользования и застройки, устанавливает правовой режим использования территориальных зон и зоны инвестиционного развития. Генеральный план территории – это технический документ, на основании которого происходит планировка, застройка и другие виды градостроительного освоения территории. Главная задача генплана – спроектировать городские территории с учётом социальных, экономических, природных, экологических и других факторов.
Согласно грк РФ, генеральный план − это научно обоснованный план развития населенного пункта, на основании которого ведутся планировка, застройка, реконструкция и другие виды освоения территории. Генплан содержит 4 основных элемента. Генеральный план содержит карту функциональных зон поселения или городского округа. Функциональные зоны – это территории с определённым назначением, которые выделяются в рамках территориального планирования. Они делятся на типы: жилая застройка, общественно-деловая застройка, производственная застройка и рекреационные зоны. Функциональное зонирование учитывается при установлении границ и градостроительных регламентов территориальных зон в рамках градостроительного зонирования при разработке правил
землепользования и застройки.
Границы функциональных зон определяются с учётом нескольких факторов:
• Возможность сочетания различных видов использования земельных участков;
• Параметры планируемого развития функциональных зон, определённые генеральным
планом поселения или муниципального образования;
• Территориальные зоны, определённые Градостроительным кодексом;
• Сложившаяся планировка территории и существующее землепользование;
• Планируемые изменения границ земель различных категорий;
• Предотвращение возможности причинения вреда объектам капитального строительства на смежных земельных участках;
• Историко-культурный опорный план исторического поселения.
Генеральный план территории формируется с учетом как минимум трех групп факторов:
1. Природно-территориальные факторы, к которым можно отнести рельеф, геологическое строение, гидрологию, климат, почвы, растительность и животный мир.
2. Техногенные факторы, или состояние инженерных систем, транспортная инфраструктура, экологические аспекты.
3. Социально-экономические и демографические факторы развития территории, в т.ч.
Численность населения, ее возрастная структура, занятость, доходы, жилищные условия и уровень образования в поселении или городском округе. При составлении генерального плана могут учитываться и другие факторы, такие как
стратегии и программы развития отдельных отраслей экономики региона, данные социальноэкономических программ развития городских округов, поселений, данные о состоянии территории, содержащиеся в государственных реестрах, а также коммерческие и инвестиционные
интересы поселения или застройщика. Процесс разработки генерального плана проходит 10 этапов от принятия решения до утверждения. ",научный
"На организационном этапе осуществляется формирование партнерств между заинтересованными сторонами, разрабатывается структура управления региональным процессом цифровизации. На этапе разработки осуществляется разработка и формализация стратегического
видения результатов цифровой трансформации региона. На этапе планирования осуществляется разработка комплекса стратегических планов цифровой трансформации: на уровне региона, на уровне отдельных отраслей, на уровне муниципалитетов. После этого формируются программы и «дорожные карты» для внедрения в региональную и муниципальную экономику разработанных стратегических планов.
На этапе реализации осуществляется непосредственное внедрение разработанных программ в соответствии с «дорожными картами». Этап мониторинга посвящен сопоставлению
плановых результатов цифровизации региональной экономики с фактическими и оценке эффективности реализованных стратегических планов. Можно отметить следующие преимущества подхода к разработке региональных проектов и программ цифровизации на основе методологии DECA. Во-первых, управление цифровизацией региона осуществляется на основе многоэтапного анализа и оценки ситуации в регионе. Во-вторых, данный подход обеспечивает структуризацию процесса региональной
цифровизации. В-третьих, в рамках данного подхода формируется концептуальная схема осуществления процесса цифровизации региона. В то же время можно отметить и существенный
недостаток данного подхода: при его применении внимание акцентируется в большей степени на оценке положения в регионе, чем на управлении развитием региона в контексте цифровизации.
Таким образом, анализ представленных в открытом доступе региональных программ цифровизации показал, что проблема методологического обеспечения процесса разработки региональных программ цифровизации по-прежнему остается актуальной. Необходимо обеспечить переход региональных проектов цифровизации от экспертно-эвристического подхода
к количественному обоснованию процессов выбора целевых ориентиров, инструментария, ресурсов и мероприятий по осуществлению цифровой трансформации регионов. При этом для
количественного обоснования различных аспектов региональных проектов цифровизации целесообразно использовать критерии достигаемой социально-экономической эффективности
проектов и уровня риска. В рамках предлагаемого подхода к формированию региональных проектов цифровизации следует решить при разработке регионального проекта цифровизации ряд задач научнопрактического характера.
Во-первых, необходимо оценить уровень использования в регионе современных цифровых технологий в таких сферах как государственное управление, социальная сфера и экономика.
Во-вторых, необходимо сформировать методологический аппарат, который позволит эффективно планировать цели цифровизации региона и объективно оценивать результаты деятельности по цифровизации.
В-третьих, необходимо сформировать перечень возможных вариантов осуществления цифровизации региона и осуществить их сравнение на основе количественного анализа, после чего выбрать оптимальный.
В-четвертых, необходимо сформировать оптимальный для выбранного варианта цифровизации организационно-финансовый механизм осуществления регионального проекта, сформировать ресурсное обеспечение проекта.
В-пятых, необходимо сформировать реестр рисков регионального проекта цифровизации, провести их качественный и количественный анализ и разработать комплекс мер по управлению выявленными рисками. Наконец, необходимо сформировать прогноз результатов реализации регионального проекта цифровизации в разрезе краткосрочного, среднесрочного и долгосрочного периодов. В процессе формирования перечня вариантов осуществления цифровизации региона целесообразно проанализировать возможности применения цифровых технологий в масштабе
региона.",научный
